DOI,Document title,Abstract,REASON
10.1145/3712285.3759887,STELLAR: Storage Tuning Engine Leveraging LLM Autonomous Reasoning for High Performance Parallel File Systems,"I/O performance is crucial to efficiency in data-intensive scientific computing; but tuning large-scale storage systems is complex, costly, and notoriously manpower-intensive, making it inaccessible for most domain scientists. To address this problem, we propose STELLAR, an autonomous tuner for high-performance parallel file systems. Our evaluations show that STELLAR almost always selects near-optimal configurations for the parallel file systems within the first five attempts, even for previously unseen applications. STELLAR’s human-like efficiency is fundamentally different from existing autotuning methods, which often require hundreds of thousands of iterations to converge. STELLAR achieves this through autonomous end-to-end agentic tuning. Powered by large language models (LLMs), STELLAR is capable of (1) accurately extracting tunable parameters from software manuals, (2) analyzing I/O trace logs generated by applications, (3) selecting initial tuning strategies, (4) rerunning applications on real systems and collecting I/O performance feedback, (5) adjusting tuning strategies and repeating the tuning cycle, and (6) reflecting on and summarizing tuning experiences into reusable knowledge for future optimizations. STELLAR integrates retrieval-augmented generation (RAG), external tool execution, LLM-based reasoning, and a multiagent design to stabilize reasoning and combat hallucinations. We evaluate how each of these components impacts optimization outcomes, thus providing insight into the design of similar systems for other optimization problems. STELLAR’s architecture and empirical validation open new avenues for tackling complex system optimization challenges, especially those characterized by vast search spaces and high exploration costs. Its highly efficient autonomous tuning will broaden access to I/O performance optimizations for domain scientists with minimal additional resource investment.",
10.1145/3715709,Thinking Fast and Slow in Human and Machine Intelligence,"When working to build machines that have a form of intelligence, it is natural to be inspired by human intelligence. Of course, humans are very different from machines, in their embodiment and myriad other ways. Humans exploit their bodies to experience the world, create an internal model of it, and use this model to reason, learn, and make contextual and informed decisions. Machines lack the same embodiment, but often have access to both more memory and more computing power. Despite these crucial disanalogies, it is still useful to leverage our knowledge of how the human mind reasons and makes decisions to design and build machines that demonstrate behaviors similar to that of a human. In this article, we present a novel AI architecture, Slow and Fast AI (SOFAI), that is inspired by the “thinking fast and slow” cognitive theory of human decision making. SOFAI is a multi-agent architecture that employs both “fast” and “slow” solvers underneath a metacognitive agent that is able to both choose among a set of solvers as well as reflect on and learn from past experience. Experimental results on the behavior of two instances of the SOFAI architecture show that, compared to using just one of the two decision modalities, SOFAI is markedly better in terms of decision quality, resource consumption, and efficiency.Modeling AI systems on dual-process theories of human cognition can improve their ability to flexibly handle diverse tasks.",
10.1145/3715761,Integrating Large Language Models and Reinforcement Learning for Non-linear Reasoning,"Large Language Models (LLMs) were shown to struggle with long-term planning, which may be caused by the limited way in which they explore the space of possible solutions. We propose an architecture where a Reinforcement Learning (RL) Agent guides an LLM's space exploration: (1) the Agent has access to domain-specific information, and can therefore make decisions about the quality of candidate solutions based on specific and relevant metrics, which were not explicitly considered by the LLM's training objective; (2) the LLM can focus on generating immediate next steps, without the need for long-term planning. We allow non-linear reasoning by exploring alternative paths and backtracking. We evaluate this architecture on the program equivalence task, and compare it against Chain of Thought (CoT) and Tree of Thoughts (ToT). We assess both the downstream task, denoting the binary classification, and the intermediate reasoning steps. Our approach compares positively against CoT and ToT.",
10.1145/3717511.3747067,"BEE: Belief-Value-Aligned, Explainable, and Extensible Cognitive Framework for Conversational Agents","Recent advances in large language models have enabled virtual agents to exhibit increasingly believable social behaviors. However, creating social agents that remain consistent with a defined profile and explain their reasoning remains challenging. We introduce a cognitive framework designed to address these gaps. Our framework features a graph-based memory module (concept pool) and a decision-making process inspired by human cognition. The concept pool contains an agent’s beliefs, values, and background stories for context-dependent retrieval. The decision-making process uses the concept pool to produce belief-value aligned responses of the virtual agent and intuitive, human-readable explanations of the reasoning. To evaluate the effectiveness of our framework, we created two virtual agents based on historical figures and compared them to baseline agents. Our evaluation combined quantitative assessments of belief-value alignment with a user study (n=48) examining explainable agency. Results show that our framework exhibits model-agnostic improved belief-value alignment and produces more detailed, relevant, and understandable explanations. By grounding virtual agent behavior in structured memories and cognitive principles, our framework offers a compelling step toward more coherent and socially intelligent virtual agents.",
10.1145/3723498.3723702,Evaluating Large Language Models through Communication Games: An Agent-Based Framework Using Werewolf in Unity,"In this study, we explore the reasoning capabilities of Large Language Models (LLMs) within the context of the social communication game Werewolf, aiming to evaluate their performance in managing complex system states commonly found in computer games. Our agent architecture gathers data, refines them into detailed information, and plans actions based on this knowledge. To demonstrate the feasibility of using LLM based agents in computer games, we developed a simulation and evaluation tool using the Unity game engine. This software enables users to experiment with various LLMs and agent architectures and to measure model performance within the application.For evaluation, we tested three models: GPT-3.5 Turbo, Mistral-7B-OpenOrca, and Nous-Hermes-Llama2-13B. The results show that even smaller models can perform reasonably well in Werewolf. However, their error rate is significantly higher, highlighting the need for additional software modules or fine-tuning to improve their accuracy.",
10.1145/3725783.3764388,Between Promise and Pain: The Reality of Automating Failure Analysis in Microservices with LLMs,"Large Language Models (LLMs) are increasingly explored as general-purpose assistants for infrastructure operations, helping automate tasks like querying data, analyzing logs, and suggesting fixes. In this paper, we consider the more general and ambitious problem of fully automating root cause analysis (RCA) in microservice systems, where LLMs must collect information, reason about it, and interact with the environment to detect, localize and resolve issues. Anecdotal evidence offers useful insights and partial solutions, but the broader challenge remains unresolved. We systematically evaluate multiple LLM agent architectures across a range of incident scenarios. We study how different tool-augmented agents perform, and shed light on common failure modes, including hallucinated reasoning paths and inefficient use of context. Our findings reveal both the promise and the limitations of current approaches, and point to concrete directions for more robust and effective use of LLMs in this domain.",
10.1145/3731599.3767401,Agentic AI vs ML-based Autotuning: A Comparative Study for Loop Reordering Optimization,"High Performance Computing (HPC) applications rely heavily on code optimizations to achieve good performance on modern CPU and GPU architectures. Traditional Machine Learning autotuning approaches have demonstrated success in exploring high-dimensional spaces, but they often require expensive compile-run evaluations and lack adaptability for large HPC applications. The recent advances in Large Language Models (LLMs) and Agentic AI systems raise intriguing questions about the potential of these approaches to address specific optimization methodologies. This work aims to answer an essential question for the HPC community: ""How Agentic AI Systems Compare to Traditional ML Autotuning Techniques?"" To address this question, we present a comparative analysis between a traditional ML-based optimization approach and an Agentic AI system, evaluating their respective capabilities and limitations for loop-level optimization. In addition, we introduced a new Agentic AI system named LoopGen-AI using three different Large Language Models: GPT-4.1, Claude 4.0, and Gemini 2.5. A key finding is that LoopGen-AI achieves competitive performance with only a few program runs, the reasoning logs from the agents revealed that their decisions rely heavily on the combination of semantic understanding of the target kernel with dynamic feedback from the environment, highlighting a promising new dimension in performance tuning. In contrast, ML-based autotuners focus on statistical exploration, and require orders of magnitude more runs to reach peak performance. Additionally, our analysis shows that prompt engineering, particularly using Persona + Context Manager patterns, significantly impacts the effectiveness of Agentic AI. Our results indicate that while Agentic AI systems are not yet a complete replacement for ML-based autotuners, it can effectively complement traditional methods.",
10.1145/3731715.3733393,MMCNav: MLLM-empowered Multi-agent Collaboration for Outdoor Visual Language Navigation,"Navigating through real-world environments, such as urban street views, poses a significant challenge for agents searching for a clear path to the destination based on environmental information. Although existing methods leveraging large language models (LLMs) have demonstrated remarkable achievements, they often struggle to tackle scenarios that require complex visual understanding. Inspired by the classical perception-cognition-action feedback loop in cognitive neuroscience, we present a multimodal large language models (MLLMs) empowered multi-agent collaborative outdoor navigation system that significantly enhances the capability to accomplish outdoor navigation tasks by extending a single agent into multiple cooperative agents. Each agent assumes a specific role in this system and collaborates to perform their respective tasks effectively. The system begins with agents interpreting human-written navigation instructions into detailed plans. At each step of the plan, agents analyze and caption the multimodal scenarios to improve their understanding of the environment. Then agents determine the search direction based on observational captions and historical decisions. At the end of the navigation, agents adopt the map of the search process to perform a two-stage reflection for error correction. Comprehensive experiments and analyses conducted on two outdoor navigation datasets demonstrate the superiority of our approach, outperforming previous methods in terms of performance. The repository of this project is available at https://github.com/zzhaesc/MMCNav.",
10.1145/3745238.3745531,"A Survey of Multi-AI Agent Collaboration: Theories, Technologies and Applications","As an important application of large language model(LLM), artificial intelligence agent(AI Agent) have the ability to autonomously perceive, understand, plan, memory, act, and use tools. It can automate complex tasks and effectively empower various business scenarios. Single AI Agent flexible and diverse deployment, multi-AI Agent innovative interaction and collaboration, multi-AI Agent collaboration improves the autonomy of the intelligent system by integrating the capabilities of single AI Agent. This paper provides an overview of multi-AI Agent from four aspects. Firstly, the core capabilities of AI Agent were outlined, and multi-AI Agent collaboration was introduced and its characteristics were analyzed. Secondly, the theoretical basis, key technologies, and scenario applications of multi-AI Agent collaboration were discussed, and the mechanism, architecture design, communication protocol, reinforcement learning, security and trustworthiness of multi-AI Agent collaboration were deeply studied. Thirdly, the advantages and disadvantages of multi-AI Agent collaboration in technology, application, and security directions were summarized, and frontier research and innovation directions were provided. Finally, a summary and outlook were made on the high-quality development of multi-AI Agent collaboration.",
10.1145/3746027.3754542,InteractGuide: LLM-Enhanced Multimodal Reasoning for User-Centric Interaction Recommendations in AR-HRI Authoring,"Augmented Reality (AR) enhances Human-Robot Interaction (HRI) by offering diverse interaction methods. However, existing systems often fail to resolve the conflict between a user's implicit preferences and physical ergonomics, leading to suboptimal experiences. We introduce InteractGuide, a novel framework that, for the first time, uses a Large Language Model (LLM) as a central reasoning engine to dynamically balance these competing factors. Our system translates physiological signals into a symbolic ''Preference Memory'' that the LLM reasons over, alongside real-time ergonomic and contextual data, to provide personalized interaction recommendations. A 29-participant study confirms our architecture improves efficiency and experience compared to single-factor approaches, showing the potential of LLMs as reasoning engines for complex AR-HRI. This work presents a validated end-to-end architecture for user-centric interaction adaptation, demonstrating the potential of LLMs as reasoning engines in complex AR-HRI systems.",
10.1145/3746027.3754761,HM-RAG: Hierarchical Multi-Agent Multimodal Retrieval Augmented Generation,"While Retrieval-Augmented Generation (RAG) augments Large Language Models (LLMs) with external knowledge, conventional single-agent RAG remains fundamentally limited in resolving complex queries demanding coordinated reasoning across heterogeneous data ecosystems. We present HM-RAG, a novel Hierarchical Multi-agent Multimodal RAG framework that pioneers collaborative intelligence for dynamic knowledge synthesis across structured, unstructured, and graph-based data. The framework is composed of a three-tiered architecture with specialized agents: a Decomposition Agent that dissects complex queries into contextually coherent sub-tasks via semantic-aware query rewriting and schema-guided context augmentation; Multi-source Retrieval Agents that carry out parallel, modality-specific retrieval using plug-and-play modules designed for vector, graph, and web-based databases; and a Decision Agent that uses consistency voting to integrate multi-source answers and resolve discrepancies in retrieval results through Expert Model Refinement. This architecture attains comprehensive query understanding by combining textual, graph-relational, and web-derived evidence, resulting in a remarkable 12.95\% improvement in answer accuracy and a 3.56\% boost in question classification accuracy over baseline RAG systems on the ScienceQA and CrisisMMD benchmarks. Notably, HM-RAG establishes state-of-the-art results in zero-shot settings on both datasets. Its modular architecture ensures seamless integration of new data modalities while maintaining strict data governance, marking a significant advancement in addressing the critical challenges of multimodal reasoning and knowledge synthesis in RAG systems.",
10.1145/3746027.3755425,From Model Diagram to Code: A Benchmark Dataset and Multi-Agent Framework,"Model Diagram-to-Code Generation aims to translate model diagrams from research papers into implementation code that reconstructs the model's architecture. This task plays a crucial role in accelerating scientific workflows and enhancing the efficiency of industrial model deployment. While recent studies have explored various Image-to-Code Generation tasks using Multimodal Large Language Models (MLLMs), these efforts have primarily focused on reconstructing the visual appearance depicted in input images, leaving this task largely underexplored. The complex structural elements and implicit relationships in model diagrams present greater challenges for MLLMs, particularly in terms of visual reasoning and semantic interpretation. To support this task, we introduce MDCDataset, a dataset designed to evaluate the ability of MLLMs to generate code from model diagrams. It comprises 1,008 instances spanning 16 research domains, each with a model diagram, structured textual content, and the ground-truth code implementation. Furthermore, to address the inherent challenges of this task, we propose MDCAgent, a collaborative multi-agent framework composed of Parsing, Generation, and Check Agents. These agents work in coordination to analyze, extract, and verify complex elements and implicit relationships within model diagrams, thereby enhancing the visual architecture-aware reasoning capabilities of MLLMs. Our extensive experiments confirm the effectiveness of the framework.",
10.1145/3746027.3755537,GraphVideoAgent: Enhancing Long-form Video Understanding with Entity Relation Graphs,"Long-form video understanding (LVU) addresses the challenge of answering complex questions over extended video length, where informative cues are sparse and easily overwhelmed by redundant content. To tackle this, it requires selecting a small set of question-relevant keyframes and reasoning over long-range, temporally dispersed visual evidence. However, current methods typically extract frame-level features with limited temporal context and store them in sequential memory structures. As a result, they struggle to capture the evolving relations among entities and fail to maintain identity consistency when entities temporarily leave and later reappear in the video. These limitations prevent accurate keyframe localization and coherent reasoning.In this paper, we propose GraphVideoAgent, a novel agent-based LVU framework that integrates a dynamic entity relation graph with a large language model (LLM)-based multi-round reasoning. Our framework emulates human cognitive strategies by iteratively retrieving keyframes and explicitly tracking both temporal and semantic interactions among entities. Our GraphVideoAgent iteratively reflects on question cues and visual observations, while the graph memory maintains a structured representation of evolving entity states and their causal relations. This design enables accurate keyframe selection, effective reasoning over sparse visual evidence, and interpretable prediction. Extensive experiments on two LVU benchmarks, EgoSchema and NExT-QA, demonstrate that GraphVideoAgent achieves state-of-the-art performance while using only 8.2 and 8.1 frames on average, significantly improving both accuracy and efficiency.",
10.1145/3746027.3755643,The Eye of Sherlock Holmes: Uncovering User Private Attribute Profiling via Vision-Language Model Agentic Framework,"Our research reveals a new privacy risk associated with the vision language model (VLM) agentic framework: the ability to infer sensitive attributes (e.g., age and health information) and even abstract ones (e.g., personality and social traits) from a set of personal images, which we term ''image private attribute profiling.'' This threat is particularly severe given that modern apps can easily access users' photo albums, and inference from image sets enables models to exploit inter-image relations for more sophisticated profiling. However, two main challenges hinder our understanding of how well VLMs can profile an individual from a few personal photos: (1) the lack of benchmark datasets with multi-image annotations for private attributes, and (2) the limited ability of current multimodal large language models (MLLMs) to infer abstract attributes from large image collections. In this work, we construct PAPI, the largest dataset for studying private attribute profiling in personal images, comprising 2,510 images from 251 individuals with 3,012 annotated privacy attributes. We also propose HolmesEye, a hybrid agentic framework that combines VLMs and LLMs to enhance privacy inference. HolmesEye uses VLMs to extract both intra-image and inter-image information and LLMs to guide the inference process as well as consolidate the results through forensic analysis, overcoming existing limitations in long-context visual reasoning. Experiments reveal that HolmesEye achieves a 10.8\% improvement in average accuracy over state-of-the-art baselines and surpasses human-level performance by 15.0\% in predicting abstract attributes. This work highlights the urgency of addressing privacy risks in image-based profiling and offers both a new dataset and an advanced framework to guide future research in this area.",
10.1145/3746027.3755832,CogDDN: A Cognitive Demand-Driven Navigation with Decision Optimization and Dual-Process Thinking,"Mobile robots are increasingly required to navigate and interact within unknown and unstructured environments to meet human demands. Demand-driven navigation (DDN) enables robots to identify and locate objects based on implicit human intent, even when object locations are unknown. However, traditional data-driven DDN methods rely on pre-collected data for model training and decision-making, limiting their generalization capability in unseen scenarios. In this paper, we propose CogDDN, a VLM-based framework that emulates the human cognitive and learning mechanisms by integrating fast and slow thinking systems and selectively identifying key objects essential to fulfilling user demands. CogDDN identifies appropriate target objects by semantically aligning detected objects with the given instructions. Furthermore, it incorporates a dual-process decision-making module, comprising a Heuristic Process for rapid, efficient decisions and an Analytic Process that analyzes past errors, accumulates them in a knowledge base, and continuously improves performance. Chain of Thought (CoT) reasoning strengthens the decision-making process. Extensive closed-loop evaluations on the AI2Thor simulator with the ProcThor dataset show that CogDDN outperforms single-view camera-only methods by 15\%, demonstrating significant improvements in navigation accuracy and adaptability. The project page is available at https://yuehaohuang.github.io/CogDDN/.",
10.1145/3746027.3762011,Agent-MER: A Cognitive Agent with Hierarchical Deliberation for Open-Vocabulary Multimodal Emotion Recognition,"This paper focuses on Open-Vocabulary Multimodal Emotion Recognition (OV-MER) and is dedicated to solving the two challenges it faces: concept semantic misalignment and incomplete coverage of fine-grained emotion categories. To address this, we propose a novel cognitive agent framework (Agent-MER), which reframes the OV-MER task as a problem to be solved by an agent that mimics the human cognitive process through knowledge-guided deliberation. We first construct a hierarchical Emotion Tree to serve as the agent's knowledge base. Building on this, we design a Knowledge-Guided Hierarchical Deliberation reasoning process. This process systematically explores the entire emotional landscape through a three-level, coarse-to-fine iterative reasoning process, enabling the identification of a richer and deeper range of emotions. Finally, a Self-Consistent Voting mechanism is employed to aggregate the results from multiple reasoning runs, ensuring the robustness of the final output. Experiments conducted in the MER2025 Challenge demonstrate that our proposed method achieved a top-ranking score of 61.04\%, securing first place and significantly outperforming existing baselines. This work not only provides an effective solution for OV-MER but also opens up new avenues for developing more human-like affective intelligence systems.",
