DOI,Document title,Abstract,REASON
10.1109/TITS.2024.3357479,A Hierarchical Hybrid Learning Framework for Multi-Agent Trajectory Prediction,"Accurate trajectory prediction for neighboring agents is crucial for autonomous vehicles navigating complex scenes. Recent deep learning (DL) methods excel in encoding complex interactions but often generate invalid predictions due to difficulties in modeling transient and contingency interactions. This paper proposes a hierarchical hybrid framework that combines DL and reinforcement learning (RL) for multi-agent trajectory prediction, capturing multi-scale interactions that shape future motion. In the DL stage, Transformer-style graph neural network (GNN) is employed to encode heterogeneous interactions at intermediate and global scales, predicting multi-modal intentions as key future positions for agents. In the RL stage, we divide the scene into local scenes based on DL predictions. A Transformer-based Proximal Policy Optimization (PPO) model, incorporated with vehicle kinematics, generates future trajectories in the form of motion planning shaped by microscopic interactions and guided by a multi-objective reward for balanced agent-centric accuracy and scene-wise compatibility. Experimental results on the Argoverse benchmark and driver-in-loop simulations demonstrate that our framework enhances trajectory prediction feasibility and plausibility in interactive scenes.",
10.1109/TIV.2024.3488793,KoMA: Knowledge-Driven Multi-Agent Framework for Autonomous Driving With Large Language Models,"Large language models (LLMs) as autonomous agents offer a novel avenue for tackling real-world challenges through a knowledge-driven manner. These LLM-enhanced methodologies excel in generalization and interpretability. However, the complexity of driving tasks often necessitates the collaboration of multiple, heterogeneous agents, underscoring the need for such LLM-driven agents to engage in cooperative knowledge sharing and cognitive synergy. Despite the promise of LLMs, current applications predominantly center around single-agent scenarios. To broaden the horizons of knowledge-driven strategies and bolster the generalization capabilities of autonomous agents, we propose the KoMA framework consisting of multi-agent interaction, multi-step planning, shared-memory, and ranking-based reflection modules to enhance multi-agents' decision-making in complex driving scenarios. Based on the framework's generated text descriptions of driving scenarios, the multi-agent interaction module enables LLM agents to analyze and infer the intentions of surrounding vehicles based on scene information, akin to human cognition. The multi-step planning module enables LLM agents to analyze and obtain final action decisions layer by layer to ensure consistent goals for short-term action decisions. The shared memory module can accumulate collective experience to make superior decisions, and the ranking-based reflection module can evaluate and improve agent behavior with the aim of enhancing driving safety and efficiency. The KoMA framework not only enhances the robustness and adaptability of autonomous driving agents but also significantly elevates their generalization capabilities across diverse scenarios. Empirical results demonstrate the superiority of our approach over traditional methods, particularly in its ability to handle complex, unpredictable driving environments without extensive retraining.",
10.1109/TMECH.2024.3452509,A Survey of Optimization-Based Task and Motion Planning: From Classical to Learning Approaches,"Task and motion planning (TAMP) integrates high-level task planning and low-level motion planning to equip robots with the autonomy to effectively reason over long-horizon, dynamic tasks. Optimization-based TAMP focuses on hybrid optimization approaches that define goal conditions via objective functions and are capable of handling open-ended goals, robotic dynamics, and physical interaction between the robot and the environment. Therefore, optimization-based TAMP is particularly suited to solve highly complex, contact-rich locomotion and manipulation problems. This survey provides a comprehensive review on optimization-based TAMP, covering first, planning domain representations, including action description languages and temporal logic, second, individual solution strategies for components of TAMP, including AI planning and trajectory optimization (TO), and finally, the dynamic interplay between logic-based task planning and model-based TO. A particular focus of this survey is to highlight the algorithm structures to efficiently solve TAMP, especially hierarchical and distributed approaches. In addition, the survey emphasizes the synergy between the classical methods and contemporary learning-based innovations, such as large language models. Furthermore, the future research directions for TAMP is discussed in this survey, highlighting both algorithmic and application-specific challenges.",
10.1109/TNET.2023.3289172,Ensuring Threshold AoI for UAV-Assisted Mobile Crowdsensing by Multi-Agent Deep Reinforcement Learning With Transformer,"Unmanned aerial vehicle (UAV) crowdsensing (UCS) is an emerging data collection paradigm to provide reliable and high quality urban sensing services, with age-of-information (AoI) requirement to measure data freshness in real-time applications. In this paper, we explicitly consider the case to ensure that the attained AoI always stay within a specific threshold. The goal is to maximize the total amount of collected data from diverse Point-of-Interests (PoIs) while minimizing AoI and AoI threshold violation ratio under limited energy supplement. To this end, we propose a decentralized multi-agent deep reinforcement learning framework called “DRL-UCS(&lt;inline-formula&gt; &lt;tex-math notation=""LaTeX""&gt;$text {AoI}_{th}$ &lt;/tex-math&gt;&lt;/inline-formula&gt;)” for multi-UAV trajectory planning, which consists of a novel transformer-enhanced distributed architecture and an adaptive intrinsic reward mechanism for spatial cooperation and exploration. Extensive results and trajectory visualization on two real-world datasets in Beijing and San Francisco show that, DRL-UCS(&lt;inline-formula&gt; &lt;tex-math notation=""LaTeX""&gt;$text {AoI}_{th}$ &lt;/tex-math&gt;&lt;/inline-formula&gt;) consistently outperforms all nine baselines when varying the number of UAVs, AoI threshold and generated data amount in a timeslot.",
10.1109/TNNLS.2021.3128380,Toward Cognitive Navigation: Design and Implementation of a Biologically Inspired Head Direction Cell Network,"As a vital cognitive function of animals, the navigation skill is first built on the accurate perception of the directional heading in the environment. Head direction cells (HDCs), found in the limbic system of animals, are proven to play an important role in identifying the directional heading allocentrically in the horizontal plane, independent of the animal’s location and the ambient conditions of the environment. However, practical HDC models that can be implemented in robotic applications are rarely investigated, especially those that are biologically plausible and yet applicable to the real world. In this article, we propose a computational HDC network that is consistent with several neurophysiological findings concerning biological HDCs and then implement it in robotic navigation tasks. The HDC network keeps a representation of the directional heading only relying on the angular velocity as an input. We examine the proposed HDC model in extensive simulations and real-world experiments and demonstrate its excellent performance in terms of accuracy and real-time capability.",
10.1109/TNNLS.2023.3247160,Representation Learning and Reinforcement Learning for Dynamic Complex Motion Planning System,"Indoor motion planning challenges researchers because of the high density and unpredictability of moving obstacles. Classical algorithms work well in the case of static obstacles but suffer from collisions in the case of dense and dynamic obstacles. Recent reinforcement learning (RL) algorithms provide safe solutions for multiagent robotic motion planning systems. However, these algorithms face challenges in convergence: slow convergence speed and suboptimal converged result. Inspired by RL and representation learning, we introduced the ALN-DSAC: a hybrid motion planning algorithm where attention-based long short-term memory (LSTM) and novel data replay combine with discrete soft actor–critic (SAC). First, we implemented a discrete SAC algorithm, which is the SAC in the setting of discrete action space. Second, we optimized existing distance-based LSTM encoding by attention-based encoding to improve the data quality. Third, we introduced a novel data replay method by combining the online learning and offline learning to improve the efficacy of data replay. The convergence of our ALN-DSAC outperforms that of the trainable state of the arts. Evaluations demonstrate that our algorithm achieves nearly 100% success with less time to reach the goal in motion planning tasks when compared to the state of the arts. The test code is available at https://github.com/CHUENGMINCHOU/ALN-DSAC.",
10.1109/TNSE.2022.3188304,A Hybrid Deep Sensor Anomaly Detection for Autonomous Vehicles in 6G-V2X Environment,"Autonomous Vehicles (AVs) exchange real-time and seamless data between other AVs and the network, thus revolutionizing the Intelligent Transportation System (ITS). Automated transportation brings numerous benefits to human beings. However, the concerns such as safety, security, and privacy keep rising. In navigation and trajectory planning, the AVs require exchanging sensory information from their own and other AVs. In such cases, when a malicious AV or faulty sensor-equipped AV comes into connectivity, it can have disruptive consequences. This paper proposes a Hybrid Deep Anomaly Detection (HDAD) approach for effective anomaly detection and cyber-attack mitigation in AVs. The Multi-Agent Reinforcement Learning (MARL) algorithm in HDAD approach acts over the 6G network to combat new-age cyber-attacks and provide a swift and accurate anomaly detection mechanism. In conjunction with Maximum Entropy Inverse Reinforcement Learning (MaxEntIRL), the HDAD approach identifies and isolates malicious AVs. It is envisioned that the obtained results prove the effectiveness of HDAD and have an 8.2% higher accuracy rate than the existing systems.",
10.1109/TRO.2022.3226144,Active Inference and Behavior Trees for Reactive Action Planning and Execution in Robotics,"In this article, we propose a hybrid combination of active inference and behavior trees (BTs) for reactive action planning and execution in dynamic environments, showing how robotic tasks can be formulated as a free-energy minimization problem. The proposed approach allows handling partially observable initial states and improves the robustness of classical BTs against unexpected contingencies while at the same time reducing the number of nodes in a tree. In this work, we specify the nominal behavior offline, through BTs. However, in contrast to previous approaches, we introduce a new type of leaf node to specify the desired state to be achieved rather than an action to execute. The decision of which action to execute to reach the desired state is performed online through active inference. This results in continual online planning and hierarchical deliberation. By doing so, an agent can follow a predefined offline plan while still keeping the ability to locally adapt and take autonomous decisions at runtime, respecting safety constraints. We provide proof of convergence and robustness analysis, and we validate our method in two different mobile manipulators performing similar tasks, both in a simulated and real retail environment. The results showed improved runtime adaptability with a fraction of the hand-coded nodes compared to classical BTs.",
10.1109/TSMC.2023.3312585,Interactive Inference: A Multi-Agent Model of Cooperative Joint Actions,"We advance a novel computational model of multi-agent, cooperative joint actions that is grounded in the cognitive framework of active inference. The model assumes that to solve a joint task, such as pressing together a red or blue button, two (or more) agents engage in a process of interactive inference. Each agent maintains probabilistic beliefs about the joint goal (e.g., Should we press the red or blue button?) and updates them by observing the other agent’s movements, while in turn selecting movements that make his own intentions legible and easy to infer by the other agent (i.e., sensorimotor communication). Over time, the interactive inference aligns both the beliefs and the behavioral strategies of the agents, hence ensuring the success of the joint action. We exemplify the functioning of the model in two simulations. The first simulation illustrates a “leaderless” joint action. It shows that when two agents lack a strong preference about their joint task goal, they jointly infer it by observing each other’s movements. In turn, this helps the interactive alignment of their beliefs and behavioral strategies. The second simulation illustrates a “leader–follower” joint action. It shows that when one agent (“leader”) knows the true joint goal, it uses sensorimotor communication to help the other agent (“follower”) infer it, even if doing this requires selecting a more costly individual plan. These simulations illustrate that interactive inference supports successful multi-agent joint actions and reproduces key cognitive and behavioral dynamics of “leaderless” and “leader–follower” joint actions observed in human–human experiments. In sum, interactive inference provides a cognitively inspired, formal framework to realize cooperative joint actions and consensus in multi-agent systems.",
10.1109/TVT.2023.3344934,Distributed Multi-Agent Reinforcement Learning for Collaborative Path Planning and Scheduling in Blockchain-Based Cognitive Internet of Vehicles,"The collaborative path planning and scheduling can overcome the limitations of single vehicle intelligence to obtain a globally optimal decision strategy in cognitive Internet of Vehicles (CIoVs). The collaboration of vehicles necessitates the exchange of environmental and decision information, generating massive collaborative computing tasks with strict latency requirements. Leveraging mobile edge computing (MEC) technology, computing tasks can be processed near the vehicles to reduce latency. However, traffic congestion and computational load imbalance seriously affect traffic efficiency and computational latency. In hybrid driving scenarios, it is challenging to fulfill the diverse service requirements of vehicles with different intelligence levels. Moreover, non-collaborative tend to result in traffic congestion due to vehicle aggregation effects, while centralized solutions lack flexibility and have high computational complexity. To address these concerns, a distributed multi-agent reinforcement learning (DMARL) algorithm is proposed for collaborative path planning and scheduling in a blockchain-based collaboration framework. In this framework, we model the communication, traffic situation and task processing of the system and formulate a joint optimization problem to minimize both travel time and computation latency. Last, we convert the scheduling problem for different types of vehicles into Markov decision processes (MDPs) and propose Q-learning-based DMARL algorithm to achieve proactive load balancing of both road infrastructures and MEC nodes (MECNs). Simulation results demonstrate that the proposed approach outperforms the comparison schemes in terms of load balance indexes of roads and MECNs, travel time, and computation latency.",
10.1109/TVT.2024.3369089,Towards Intelligent Mobile Crowdsensing With Task State Information Sharing Over Edge-Assisted UAV Networks,"With the rapid development of edge computing technology, edge-assisted unmanned aerial vehicle (UAV) networks have become popular, helping with fast and cost-effective data collection in mobile crowdsensing (MCS) environments. This paper investigates the online data collection problem for MCS over an edge-assisted UAV network architecture, where UAVs work to collect the data required by tasks at different on-ground point-of-interests (PoIs) in an autonomous and cooperative manner. Different from conventional edge-assisted UAV networks, edge nodes in our paper help distribute, aggregate, share, and update the task state information (TSI, e.g., if a task has been completed, or if it still requires more data), to support efficient and cost-effective data collection, e.g., avoiding repetitive and ineffective task execution. In particular, a UAV can exchange TSI with an edge node when it is within the signal coverage of the edge node, while making decisions on PoI selection and path planning in an online and decentralized manner. To address the issue of edge-assisted UAV data collection, we propose a multi-agent deep reinforcement learning-based algorithm using personalized training with decentralized executing (PTDE) architecture. Different from the traditional centralized training with decentralized executing (CTDE) architecture, our considered architecture adopts the agent-specific state for critic networks instead of the joint observation, thus achieving effective utilization of environmental information. Furthermore, we propose an observation enhancement algorithm based on artificial potential field (APF). Extensive simulation results demonstrate that our proposed algorithm greatly outperforms baseline algorithms in terms of total profit, data collection ratio, geographical fairness, and energy efficiency.",
10.1109/TVT.2025.3533006,Mix Q-Learning for Lane Changing: A Collaborative Decision-Making Method in Multi-Agent Deep Reinforcement Learning,"Lane-changing decisions, which are crucial for autonomous vehicle path planning, face practical challenges due to rule-based constraints and limited data. Deep reinforcement learning has become a major research focus due to its advantages in data acquisition and interpretability. However, current models often overlook collaboration, which affects not only impacts overall traffic efficiency but also hinders the vehicle's own normal driving in the long run. To address the aforementioned issue, this paper proposes a method named Mix Q-learning for Lane Changing (MQLC) that integrates a hybrid value Q network, taking into account both collective and individual benefits for the greater good. At the collective level, our method coordinates the individual Q and global Q networks by utilizing global information. This enables agents to effectively balance their individual interests with the collective benefit. At the individual level, we integrate a deep learning-based intent recognition module into our observation and enhance the decision network. These changes provide agents with richer decision information and more precise feature extraction for improved lane-changing decisions. This strategy enables the multi-agent system to learn and formulate optimal decision-making strategies effectively. Our MQLC model, through extensive experimental results, impressively outperforms other state-of-the-art multi-agent decision-making methods, effectively improving the overall efficiency.",
10.1109/UR65550.2025.11078095,Development of a Mobile Assistive Robot for Daily Living Support*,"This paper develops a Mobile Assistive Robotic System (MARS) designed to assist people with disabilities by performing daily tasks such as retrieving objects and helping meal. MARS uses ROS2 framework to connect a 7-DOF robotic arm, hybrid gripper, RGB-depth cameras, and a large language model-based planner, enabling intergration of visionbased recognition, skill affordance, and natural language task planning. Through real-world experiments in cluttered environments, MARS provides a promising solution for autonomous assistive robots in dynamic home settings.",
10.1109/WI-IAT59888.2023.00062,Implementing BDI Continual Temporal Planning for Robotic Agents,"Making autonomous agents effective in real-life applications requires the ability to decide at run-time and a high degree of adaptability to unpredictable and uncontrollable events. Reacting to events is still a fundamental ability for an agent, but it has to be boosted up with proactive behaviors that allow the agent to explore alternatives and decide at run-time for optimal solutions. This calls for a continuous planning as part of the deliberation process that makes an agent able to reconsider plans on the base of temporal constraints and changes of the environment. Online planning literature offers several approaches used to select the next action on the base of a partial exploration of the solution space. In this paper, we propose a BDI continuous temporal planning framework, where interleave planning and execution loop is used to integrate online planning with the BDI control-loop. The framework has been implemented with the ROS2 robotic framework and planning algorithms offered by JavaFF.",
10.1109/WRCSARA60131.2023.10261865,Development of a Simulation Environment for Robot Soccer Game with Deep Reinforcement Learning and Role Assignment,"The robot soccer game has been recognized as an excellent scenario to test the gaming algorithm of multi-agent systems. This paper develops a new simulation platform for the robot soccer game, and it has the advantage of open architecture, such that the formation control scheme, the path planning strategy for multiple robots, and many other algorithms can be implemented and tested. Specifically, both a Deep Reinforcement Learning (DRL) scheme and a role-assignment-based method have been successfully realized in this platform to drive multiple robots to play the soccer game, including 2V2,3V3,4V4, and so on. It is believed that the developed simulation environment can be used for data collection and transfer learning (TL), hence bridging the gap of Sim2Real technique in actual implementations.",
10.1109/WSC48552.2020.9384025,Unified Devs-Based Platform for Modeling and Simulation of Hybrid Control Systems,"Recent robotic research has led to different architectural approaches that support enactment of automatically synthesized discrete event controllers from user specifications over low-level continuous variable controllers. Simulation of these hybrid control approaches to robotics can be a useful validation tool for robot users and architecture designers, but presents the key challenge of working with discrete and continuous representations of the robot, its environment and its mission plans. In this work we address this challenge showcasing a unified DEVS-based hybrid simulation platform. We model and simulate the hybrid robotic software architecture of a fixed-wing UAV, including the full stack of controllers involved: discrete, hybrid and continuous. We validate the approach experimentally on a typical UAV mapping mission and show that with our unified approach we are able to achieve simulation speed-ups up to one order of magnitude above our previous Software In The Loop simulation setup.",
10.1117/12.3013861,"Modular, Hierarchical Machine Learning for Sequential Goal Completion","Given a maze populated with different objects, one may task a robot with a sequential goal completion task, e.g. 1) pick up a key then 2) unlock the door then 3) unlock the treasure chest. A typical machine learning (ML) solution would involve a monolithically trained artificial neural network (ANN). However, if the sequence of goals or the goals themselves change, then the ANN must be significantly (or, at worst, completely) retrained. Instead of a monolithic ANN, a modular ML component would be 1) independently optimizable (task-agnostic) and 2) arbitrarily reconfigurable with other ML modules. This work describes a modular, hierarchical ML framework by integrating two emerging ML techniques: 1) cognitive map learners (CML) and 2) hyperdimensional computing (HDC). A CML is a collection of three single layer ANNs (matrices) collaboratively trained to learn the topology of an abstract graph. Here, two CMLs were constructed, one describing locations on in 2D physical space and the other the relative distribution of objects found in this space. Each CML node states was encoded as a high-dimensional vector to utilize HDC, an ML algebra, for symbolic reasoning over these high-dimensional “symbol” vectors. In this way, each sub-goal above was described by algebraic equations of CML node states. Multiple, independently trained CMLs were subsequently assembled together to navigate a maze to solve a sequential goal task. Critically, changes to these goals required only localized changes in the CML-HDC architecture, as opposed to a global ANN retraining scheme. This framework therefore enabled a more traditional engineering approach to ML, akin to digital logic design. © 2024 SPIE.",
