DOI,Document title,Abstract,REASON
10.1109/ICPS65515.2025.11087877,Toward the Trust-Enhanced MAPE-K Loop: A Novel Robotic Software Architecture,"Modern robotic applications frequently employ the MAPE-K (Monitor, Analyze, Plan, Execute, and Knowledge) loop for adaptive behavior. However, in unprecedented situations, the functionality of the MAPE-K loop often degrades, limiting its effectiveness. Moreover, In robotic applications, a distributed MAPE-K loop may be necessary for enabling adaptability across diverse deployment environments. To address this challenge, we propose a novel robotic software architecture designed to enhance trustworthiness, modularity and portability within the MAPE-K framework. Our approach introduces placeholders for trustworthiness checks to ensure robust operation in dynamic environments. Additionally, the architecture is developed in a distributed manner to enable scalability and portability across diverse robotic systems. The architecture is implemented using Python, with distributed backend for knowledge and communication handling to validate its performance, we conducted tests using a TurtleBot 4 use case, demonstrating the feasibility and benefits of our design.",
10.1109/ICRA48506.2021.9562028,Visual Perspective Taking for Opponent Behavior Modeling,"In order to engage in complex social interaction, humans learn at a young age to infer what others see and cannot see from a different point-of-view, and learn to predict others’ plans and behaviors. These abilities have been mostly lacking in robots, sometimes making them appear awkward and socially inept. Here we propose an end-to-end long-term visual prediction framework for robots to begin to acquire both these critical cognitive skills, known as Visual Perspective Taking (VPT) and Theory of Behavior (TOB). We demonstrate our approach in the context of visual hide-and-seek – a game that represents a cognitive milestone in human development. Unlike traditional visual predictive model that generates new frames from immediate past frames, our agent can directly predict to multiple future timestamps (25 s), extrapolating by 175% beyond the training horizon. We suggest that visual behavior modeling and perspective taking skills will play a critical role in the ability of physical robots to fully integrate into real-world multi-agent activities.",
10.1109/ICRA48891.2023.10160530,Active Predictive Coding: Brain-Inspired Reinforcement Learning for Sparse Reward Robotic Control Problems,"In this article, we propose a backpropagation-free approach to robotic control through the neuro-cognitive computational framework of neural generative coding (NGC), designing an agent completely built from predictive processing circuits that facilitate dynamic, online learning from sparse rewards, embodying the principles of planning-as-inference. Concretely, we craft an adaptive agent system, which we call active predictive coding (ActPC), that balances an internally-generated epistemic signal (meant to encourage intelligent exploration) with an internally-generated instrumental signal (meant to encourage goal-seeking behavior) to learn how to control various simulated robotic systems as well as a complex robotic arm using a realistic simulator, i.e., the Surreal Robotics Suite, for the block lifting task and the can pick-and-place problem. Notably, our results demonstrate that the proposed ActPC agent performs well in the face of sparse (extrinsic) reward signals and is competitive with or outperforms several powerful backpropagation-based reinforcement learning approaches.",
10.1109/ICRA48891.2023.10160545,Learning Neuro-symbolic Programs for Language Guided Robot Manipulation,"Given a natural language instruction and an input scene, our goal is to train a model to output a manipulation program that can be executed by the robot. Prior approaches for this task possess one of the following limitations: (i) rely on hand-coded symbols for concepts limiting generalization beyond those seen during training [1] (ii) infer action sequences from instructions but require dense sub-goal supervision [2] or (iii) lack semantics required for deeper object-centric reasoning inherent in interpreting complex instructions [3]. In contrast, our approach can handle linguistic as well as perceptual variations, end-to-end trainable and requires no intermediate supervision. The proposed model uses symbolic reasoning constructs that operate on a latent neural object-centric representation, allowing for deeper reasoning over the input scene. Central to our approach is a modular structure consisting of a hierarchical instruction parser and an action simulator to learn disentangled action representations. Our experiments on a simulated environment with a 7-DOF manipulator, consisting of instructions with varying number of steps and scenes with different number of objects, demonstrate that our model is robust to such variations and significantly outperforms baselines, particularly in the generalization settings. The code, dataset and experiment videos are available at https://nsrmp.github.io © 2023 IEEE.",
10.1109/ICRA55743.2025.11127480,Closed Loop Interactive Embodied Reasoning for Robot Manipulation,"Embodied reasoning systems integrate robotic hardware and cognitive processes to perform complex tasks, typically in response to a natural language query about a specific physical environment. This usually involves changing the belief about the scene or physically interacting and changing the scene (e.g. sort the objects from lightest to heaviest). In order to facilitate the development of such systems we introduce a new modular Closed Loop Interactive Embodied Reasoning (CLIER) approach that takes into account the measurements of non-visual object properties, changes in the scene caused by external disturbances as well as uncertain outcomes of robotic actions. CLIER performs multi-modal reasoning and action planning and generates a sequence of primitive actions that can be executed by a robot manipulator. Our method operates in a closed loop, responding to changes in the environment. Our approach is developed with the use of MuBle simulation environment and tested in $\mathbf{1 0}$ interactive benchmark scenarios. We extensively evaluate our reasoning approach in simulation and in real-world manipulation tasks with a success rate above $\mathbf{7 6 \%}$ and 64%, respectively.",
10.1109/ICRA55743.2025.11127486,Enhancing Multi-Agent Systems via Reinforcement Learning with LLM-Based Planner and Graph-Based Policy,"Multi-agent systems (MAS) have shown great potential in executing complex tasks, but coordination and safety remain significant challenges. Multi-Agent Reinforcement Learning (MARL) offers a promising framework for agent collaboration, but it faces difficulties in handling complex tasks and designing reward functions. The introduction of Large Language Models (LLMs) has brought stronger reasoning and cognitive abilities to MAS, but existing LLM-based systems struggle to respond quickly and accurately in dynamic environments. To address these challenges, we propose LLM-based Graph Collaboration MARL (LGC-MARL), a framework that efficiently combines LLMs and MARL. This framework decomposes complex tasks into executable subtasks and achieves efficient collaboration among multiple agents through graph-based coordination. Specifically, LGC-MARL consists of two main components: an LLM planner and a graph-based collaboration meta policy. The LLM planner transforms complex task instructions into a series of executable subtasks, evaluates the rationality of these subtasks using a critic model, and generates an action dependency graph. The graph-based collaboration meta policy facilitates communication and collaboration among agents based on the action dependency graph, and adapts to new task environments through meta-learning. Experimental results on the AI2-THOR simulation platform demonstrate the superior performance and scalability of LGC-MARL in completing various complex tasks.",
10.1109/ICRA55743.2025.11127617,Fast and Accurate Task Planning using Neuro-Symbolic Language Models and Multi-Level Goal Decomposition,"In robotic task planning, symbolic planners using rule-based representations like PDDL are effective but struggle with long-sequential tasks in complicated environments due to exponentially increasing search space. Meanwhile, LLM-based approaches, which are grounded in artificial neural networks, offer faster inference and commonsense reasoning but suffer from lower success rates. To address the limitations of the current symbolic (slow speed) or LLM-based approaches (low accuracy), we propose a novel neuro-symbolic task planner that decomposes complex tasks into subgoals using LLM and carries out task planning for each subgoal using either symbolic or MCTS-based LLM planners, depending on the subgoal complexity. This decomposition reduces planning time and improves success rates by narrowing the search space and enabling LLMs to focus on more manageable tasks. Our method significantly reduces planning time while maintaining high success rates across three task planning domains, as well as real-world and simulated robotics environments. More details are available at http://graphics.ewha.ac.kr/LLMTAMP/.",
10.1109/ICRA55743.2025.11127692,Neuro-Symbolic Imitation Learning: Discovering Symbolic Abstractions for Skill Learning,"Imitation learning is a popular method for teaching robots new behaviors. However, most existing methods focus on teaching short, isolated skills rather than long, multistep tasks. To bridge this gap, imitation learning algorithms must not only learn individual skills but also an abstract understanding of how to sequence these skills to perform extended tasks effectively. This paper addresses this challenge by proposing a neuro-symbolic imitation learning framework. Using task demonstrations, the system first learns a symbolic representation that abstracts the low-level state-action space. The learned representation decomposes a task into easier subtasks and allows the system to leverage symbolic planning to generate abstract plans. Subsequently, the system utilizes this task decomposition to learn a set of neural skills capable of refining abstract plans into actionable robot commands. Experimental results in three simulated robotic environments demonstrate that, compared to baselines, our neuro-symbolic approach increases data efficiency, improves generalization capabilities, and facilitates interpretability.",
10.1109/ICRA55743.2025.11128650,Curiosity-Driven Imagination: Discovering Plan Operators and Learning Associated Policies for Open-World Adaptation,"Adapting quickly to dynamic, uncertain environments—often called “open worlds” —remains a major challenge in robotics. Traditional Task and Motion Planning (TAMP) approaches struggle to cope with unforeseen changes, are data-inefficient when adapting, and do not leverage world models during learning. We address this issue with a hybrid planning and learning system that integrates two models: a low-level neural network-based model that learns stochastic transitions and drives exploration via an Intrinsic Curiosity Module (ICM), and a high-level symbolic planning model that captures abstract transitions using operators, enabling the agent to plan in an “imaginary” space and generate reward machines. Our evaluation in a robotic manipulation domain with sequential novelty injections demonstrates that our approach converges faster and outperforms state-of-the-art hybrid methods.",
10.1109/ICRA55743.2025.11128836,Work Smarter Not Harder: Simple Imitation Learning with CS-PIBT Outperforms Large-Scale Imitation Learning for MAPF,"Multi-Agent Path Finding (MAPF) is the problem of effectively finding efficient collision-free paths for a group of agents in a shared workspace. The MAPF community has largely focused on developing high-performance heuristic search methods. Recently, several works have applied various machine learning (ML) techniques to solve MAPF, usually involving sophisticated architectures, reinforcement learning techniques, and set-ups, but none using large amounts of high-quality supervised data. Our initial objective in this work was to show how simple large-scale imitation learning of high-quality heuristic search methods can lead to state-of-the-art ML MAPF performance. However, we find that, at least with our model architecture, simple large-scale (700k examples with hundreds of agents per example) imitation learning does not produce impressive results. Instead, we find that by using prior work that post-processes MAPF model predictions to resolve 1-step collisions (CS-PIBT), we can train a simple ML MAPF policy in minutes that dramatically outperforms existing ML MAPF policies. This has serious implications for all future ML MAPF policies (with local communication) which currently struggle to scale. In particular, this finding implies that future learnt policies should always (1) use smart 1-step collision shields (e.g, CS-PIBT) and (2) include the collision shield with greedy actions as a baseline (e.g. PIBT), as well as (3) motivates future models to focus on longer horizon / more complex planning as 1-step collisions can be efficiently resolved.",
10.1109/ICRA57147.2024.10610434,CoPAL: Corrective Planning of Robot Actions with Large Language Models,"In the pursuit of fully autonomous robotic systems capable of taking over tasks traditionally performed by humans, the complexity of open-world environments poses a considerable challenge. Addressing this imperative, this study contributes to the field of Large Language Models (LLMs) applied to task and motion planning for robots. We propose a system architecture that orchestrates a seamless interplay between multiple cognitive levels, encompassing reasoning, planning, and motion generation. At its core lies a novel replanning strategy that handles physically grounded, logical, and semantic errors in the generated plans. We demonstrate the efficacy of the proposed feedback architecture, particularly its impact on executability, correctness, and time complexity via empirical evaluation in the context of a simulation and two intricate real-world scenarios: blocks world, barman and pizza preparation.",
10.1109/ICRA57147.2024.10610676,Scalable Multi-Robot Collaboration with Large Language Models: Centralized or Decentralized Systems?,"A flurry of recent work has demonstrated that pre-trained large language models (LLMs) can be effective task planners for a variety of single-robot tasks. The planning performance of LLMs is significantly improved via prompting techniques, such as in-context learning or re-prompting with state feedback, placing new importance on the token budget for the context window. An under-explored but natural next direction is to investigate LLMs as multi-robot task planners. However, long-horizon, heterogeneous multi-robot planning introduces new challenges of coordination while also pushing up against the limits of context window length. It is therefore critical to find token-efficient LLM planning frameworks that are also able to reason about the complexities of multi-robot coordination. In this work, we compare the task success rate and token efficiency of four multi-agent communication frameworks (centralized, decentralized, and two hybrid) as applied to four coordination-dependent multi-agent 2D task scenarios for increasing numbers of agents. We find that a hybrid framework achieves better task success rates across all four tasks and scales better to more agents. We further demonstrate the hybrid frameworks in 3D simulations where the vision-to-text problem and dynamical errors are considered. See our project website 4 for prompts, videos, and code.",
10.1109/ICRAE53653.2021.9657781,An Switchable Multi-resolution Architecture of Cyber-Physical Manufacturing Systems (CPMS) for Industrial Robots Collaboration,"For complex manufacturing systems, fast, accurate, and reliable modeling and simulation of the real world, as well as the interaction from the simulation world to the real world, is required. The development of Cyber-Physical Systems (CPS) and Internet of Things (IoT) enable real-world manufacturing systems and their cyber world to form a manufacturing-oriented Cyber-Physical Systems - Cyber-Physical Manufacturing Systems (CPMS). However, the low performance of the edge, and the heavy storage and computing burden of the cloud, cannot meet the fast and accurate requirements of CPMS. To address these issues, this paper proposes an cloud-edge collaboration architecture of Cyber-Physical Manufacturing Systems intended for industrial robots collaboration. In the architecture, the key planning and decision are placed at a central computing station and the trivial calculation tasks are placed at the information shell of the manufacturing equipment. Specifically, robotic arms, AGVs and other manufacturing nodes are designed to store and perceive the environment and self-state, run with basic kinematics and kinetics. Reconfigurable computing nodes based on FPGA performs trivial logical calculation tasks. The manufacturing could is designed to plan and control all holonic nodes based on multi-agent deep reinforcement learning. The collaboration between robotic arm and AGV is studied as a case. The solution based on the proposed framework is given for the issue. The feasibility of the framework is verified by simulation and derivation.",
10.1109/ICSA-C65153.2025.00053,Dynamic Architectures Leveraging AI Agents and Human-in-the-Loop for Data Center Management,"To address the growing data needs, data centers are being established in new and unexplored terrains. This necessitates the development of robust data center management platforms capable of self-management. To make these systems adaptable to new uncertainties, especially in space, underwater, and remote data centers aimed at long-running or mission-critical operations, the architectures of these robust data center management platforms need to be accurately modeled to be dynamic and evolve during execution. We argue that, in addition to making systems self-managing and autonomous, there is a need for a human-centric adaptive architecture in the data center management domain. This involves incorporating human-in-the-loop mechanisms to oversee the system's self-adaptation and control anomalies and other drifting pointers that could affect the system's quality attributes. This paper also introduces AI Agents in the self-managing system, which can further enhance autonomous management flexibility by enabling dynamic system architecture changes through these agentic “digital workers.“ We propose a dynamic architecture framework combining AI Agents and Human-in-the-Loop for continuously improving data center management. The architecture expands the MAPE-K loop by introducing human-in-the-loop at the Plan phase and AI Agents at the Execute phase to enhance the dynamic architecture setup for autonomous self-managing data centers. This paper details the foundational AI Agents that need to be set at the Execute phase and provides a use case simulation evaluating one of the AI Agents from the proposed architecture. We also define the quality requirements, which may change at runtime in such dynamic architectures, and outline the scope of future work in this domain.",
10.1109/ICTAACS60400.2023.10449565,NorAGR: a NORmative Agent Groupe Role Model for Organizational Centered Open Multi-Agent Systems,"In Open Multi-Agent Systems (Open MAS), agents' architectures are heterogeneous or unspecified. In addition, unknown agents can freely join and leave the system in keeping with their own plans. Consequently, the interactions' results are inherently unmanageable likewise predicting the system's overall behavior due to the high likelihood of unwanted behavior (i.e., emergence). Hence, Agent, Group and Role (AGR) organizational model provides a support to design Open MAS where agent architecture and their implementation issues are left unspecified. However, the basic concepts proposed by the core AGR model make the control task of AGR-based Open MAS extremely difficult. For that end, the intent of this work is to extend the basic AGR model with normative concepts in order to provide a solution for the openness related problems in MAS. Also, the agent must satisfy the regular notions associated with the requested role in role assignment task. Normative extension satisfies a set of axioms, we proposed, in order to specify the declarative and operational new provided concepts.",
10.1109/IHCIT66787.2025.11198926,Multi-Agent Collaborative Closed-Loop Planning - Evaluation - Assessment Framework: Optimization and Interpretability Evaluation,"Service robots operating in open environments face two core challenges in semantic task planning: adaptation to dynamic scenes and uncertainty in symbol-to-motion mapping. This paper proposes a multi-agent collaborative closed-loop planning-evaluation framework, an LLM-driven, closed-loop optimization pipeline for task planning and feasibility auditing aimed at robust planning in complex, dynamic settings. The framework adopts a layered architecture with three LLM-based agents: a planning agent, an evaluation (validation) agent, and an assessment agent. Using a unified geometric-semantic-constraint representation, the planner generates symbolic task sequences, maps them to a predefined skill library, and performs self-checks to revise plans. The evaluation agent audits plans against preset criteria, outputs feasibility judgments and corrective suggestions, and iterates with the planner until a feasible solution is obtained. A fine-tuned assessment agent produces quantitative scores by combining task completion, efficiency, and replanning penalties, forming a human preference-aligned evaluation system. Experiments on mobile manipulation in household scenarios show task success rates of 96.9% (simple short tasks), 87.4% (simple long tasks), and $72.4 \%$ (complex long tasks), substantially improving over classical symbolic planning (PDDL) and Chain-of-Thought-guided LLM baselines. Ablation studies validate the contribution of each module. The correlation between the assessment agent’s scores and human ratings reaches 0.87. This work provides an explainable, closed-loop optimization paradigm for perception-decision-execution in embodied AI, advancing practical autonomy in open-world robotic operation.",
10.1109/IJCNN64981.2025.11228706,RA-Gen: A Controllable Code Generation Framework Using ReAct for Multi-Agent Task Execution,"Code generation models based on large language models (LLMs) have gained wide adoption, but challenges remain in ensuring safety, accuracy, and controllability, especially for complex tasks. Existing methods often lack dynamic integration of external tools, transparent reasoning, and user control over safety. To address these issues, we propose a controllable code generation framework utilizing the ReAct paradigm for multi-agent task execution. This framework is a multi-agent system designed to enable efficient, precise, and interpretable code generation through dynamic interactions between LLMs and external resources. The framework adopts a collaborative architecture comprising four specialized agents: a Planner for task decomposition, a Searcher that leverages the ReAct framework for reasoning and tool integration, a CodeGen agent for accurate code generation, and an Extractor for structured data retrieval. The ReAct-based Searcher alternates between generating reasoning traces and executing actions, facilitating seamless integration of internal knowledge with external tools (such as search engines) to enhance accuracy and user control. Experimental results show the framework’s effectiveness across multiple languages, achieving a 94.8% security rate on the SVEN dataset with CodeQL, outperforming existing approaches. Its transparent reasoning process fosters user trust and improves controllability.",
10.1109/IPDPSW66978.2025.00156,Towards Orchestrating Agentic Applications as FaaS Workflows,"Agentic applications consist of multiple agents that encapsulate tools that can be selected by an Large Language Model (LLM) to execute real-world tasks while also collaborating with other agents to solve complex applications, including scientific tasks. However, creating these agentic applications require substantial user effort, involving model selection, prompt engineering and guardrails. There are also limitation in deploying these applications on cloud platforms. In this early work, we take a step towards addressing these limitations by proposing an intuitive pattern comprising of a planner, executor, evaluator and judge agents to compose these as agentic workflows with simple prompt specifications. We also propose to model these as Function as a Service (FaaS) workflows on public/private clouds to simplify their deployment and outsourcing their orchestration. A preliminary implementation of our AgentX platform provides Python modules for these roles, which are used to compose AWS Step Functions. Our initial results on local machine and AWS using Open AI and Claude show promise in simpler compositions, but also expose challenges due to diverse behavior of LLMs. As future work, we will explore the use of our XFaaS hybrid cloud orchestration platform to deploy these on hybrid public/private clouds to leverage cost arbitrage, and offer flexible and automated selection of model to trade-off latency, accuracy and reliability.",
