DOI,Document title,Abstract,REASON
10.1007/978-3-030-82017-6_9,Towards Explainable Visionary Agents: License to Dare and Imagine,"Since their appearance, computer programs have embodied discipline and structured approaches and methodologies. Yet, to this day, equipping machines with imaginative and creative capabilities remains one of the most challenging and fascinating goals we pursue. Intelligent software agents can behave intelligently in well-defined scenarios, relying on Machine Learning (ML), symbolic reasoning, and the ability of their developers for tailoring smart behaviors to specific application domains. However, to forecast the evolution of all possible scenarios is unfeasible. Thus, intelligent agents should autonomously/creatively adapt to the world’s mutability. This paper investigates the meaning of imagination in the context of cognitive agents. In particular, it addresses techniques and approaches to let agents autonomously imagine/simulate their course of action and generate explanations supporting it, and formalizes thematic challenges. Accordingly, we investigate research areas including: (i) reasoning and automatic theorem proving to synthesize novel knowledge via inference; (ii) automatic planning and simulation, used to speculate over alternative courses of action; (iii) machine learning and data mining, exploited to induce new knowledge from experience; and (iv) biochemical coordination, which keeps imagination dynamic by continuously reorganizing it. © 2021, Springer Nature Switzerland AG.",
10.1007/978-3-031-19842-7_29,Learning Efficient Multi-agent Cooperative Visual Exploration,"We tackle the problem of cooperative visual exploration where multiple agents need to jointly explore unseen regions as fast as possible based on visual signals. Classical planning-based methods often suffer from expensive computation overhead at each step and a limited expressiveness of complex cooperation strategy. By contrast, reinforcement learning (RL) has recently become a popular paradigm for tackling this challenge due to its modeling capability of arbitrarily complex strategies and minimal inference overhead. In this paper, we propose a novel RL-based multi-agent planning module, Multi-agent Spatial Planner (MSP). MSP leverages a transformer-based architecture, Spatial-TeamFormer, which effectively captures spatial relations and intra-agent interactions via hierarchical spatial self-attentions. In addition, we also implement a few multi-agent enhancements to process local information from each agent for an aligned spatial representation and more precise planning. Finally, we perform policy distillation to extract a meta policy to significantly improve the generalization capability of final policy. We call this overall solution, Multi-Agent Active Neural SLAM (MAANS). MAANS substantially outperforms classical planning-based baselines for the first time in a photo-realistic 3D simulator, Habitat. Code and videos can be found at https://sites.google.com/view/maans. © 2022, The Author(s), under exclusive license to Springer Nature Switzerland AG.",
10.1007/978-3-031-26412-2_4,Oracle-SAGE: Planning Ahead in Graph-Based Deep Reinforcement Learning,"Deep reinforcement learning (RL) commonly suffers from high sample complexity and poor generalisation, especially with high-dimensional (image-based) input. Where available (such as some robotic control domains), low dimensional vector inputs outperform their image based counterparts, but it is challenging to represent complex dynamic environments in this manner. Relational reinforcement learning instead represents the world as a set of objects and the relations between them; offering a flexible yet expressive view which provides structural inductive biases to aid learning. Recently relational RL methods have been extended with modern function approximation using graph neural networks (GNNs). However, inherent limitations in the processing model for GNNs result in decreased returns when important information is dispersed widely throughout the graph. We outline a hybrid learning and planning model which uses reinforcement learning to propose and select subgoals for a planning model to achieve. This includes a novel action selection mechanism and loss function to allow training around the non-differentiable planner. We demonstrate our algorithms effectiveness on a range of domains, including MiniHack and a challenging extension of the classic taxi domain. © 2023, The Author(s), under exclusive license to Springer Nature Switzerland AG.",
10.1007/978-3-031-44851-5_28,Semantic Knowledge-Based Mission Planning Method According to Robot Characteristics in Outdoor Environment,"In the field of robots, many studies have been proposed to introduce advanced cognitive science into robot systems based on existing numerical information. These research directions allow robots to utilize their knowledge to simplify, understand, and efficiently plan their tasks. In this paper, we propose a semantic knowledge-based robot mission planning method in an irregular three-dimensional environment. We introduce an advanced robot mission planning method that defines the knowledge of robots and driving places based on ontology and utilizes the defined semantic knowledge. To this end, we define a robot domain based on Planning Domain Definition Language (PDDL) and solve it through a classical planner to plan the mission. Finally, we validate the suitability of the proposed method by conducting experiments with real-world robots within the campus environment and comparing them with general PDDL-based methods. © The Author(s), under exclusive license to Springer Nature Switzerland AG 2024.",
10.1007/978-3-032-00642-4_15,Supporting Human-Robot Collaboration and Safety with the Proposed Explainable Neuro-Symbolic Reasoning,"In this article, an overview of the innovative architecture of a hybrid AI neuro-symbolic architecture which uses high-resolution deep vision with probabilistic first-order logic for safety monitoring and anomaly detection in Human-Robot Collaboration environment is proposed. Firstly, the problem and the proposed solution and its application to human-robot collaboration scenarios is outlined. Then, the performance of the proposed method for anomaly detection and its conformity to the requirements defined by the end-users in realistic scenarios is discussed. © The Author(s), under exclusive license to Springer Nature Switzerland AG 2025.",
10.1007/978-981-96-7956-0_22,"The A-BDI Metamodel for Human-Level AI: Argumentation as Balancing, Dialogue and Inference","In this paper, we introduce A-BDI, the first metamodel for formal and computational argumentation. It contains three models, conceptualizing argumentation as balancing, argumentation as dialogue, and argumentation as inference respectively. Each model looks at argumentation from a different perspective, addressing its own concerns and using its own formal and computational methods. Whereas balancing is inspired by the scale metaphor and uses quantitative techniques typically found in theories in economics and neural computing, dialogue is developed in multiagent communication and interaction and uses chatbot and Large Language Models (LLMs) technology, and inference is derived from theoretical investigations in knowledge representation and reasoning and uses techniques from symbolic reasoning. By bringing together new and traditional Artificial Intelligence (AI) approaches, the A-BDI metamodel provides a formal and computational framework for human-level, neuro-symbolic, and hybrid AI. © The Author(s), under exclusive license to Springer Nature Singapore Pte Ltd. 2025.",
10.1007/s00354-024-00243-8,Neuro-Symbolic Reasoning for Multimodal Referring Expression Comprehension in HMI Systems,"Conventional Human–Machine Interaction (HMI) interfaces have predominantly relied on GUI and voice commands. However, natural human communication also consists of non-verbal communication, including hand gestures like pointing. Thus, recent works in HMI systems have tried to incorporate pointing gestures as an input, making significant progress in recognizing and integrating them with voice commands. However, existing approaches often treat these input modalities independently, limiting their capacity to handle complex multimodal instructions requiring intricate reasoning of language and gestures. On the other hand, multimodal tasks requiring complex reasoning are being challenged in the language and vision domain, but these typically do not include gestures like pointing. To bridge this gap, we explore one of the challenging multimodal tasks, called Referring Expression Comprehension (REC), within multimodal HMI systems incorporating pointing gestures. We present a virtual setup in which a robot shares an environment with a user and is tasked with identifying objects based on the user’s language and gestural instructions. Furthermore, to address this challenge, we propose a hybrid neuro-symbolic model combining deep learning’s versatility with symbolic reasoning’s interpretability. Our contributions include a challenging multimodal REC dataset for HMI systems, an interpretable neuro-symbolic model, and an assessment of its ability to generalize the reasoning to unseen environments, complemented by an in-depth qualitative analysis of the model’s inner workings. © The Author(s) 2024.",
10.1007/s10846-021-01480-5,A Hybrid Planning Approach for Accompanying Information-gathering in Plan Execution Monitoring,"Autonomous robots that execute plans in real-world environments may easily get failed due to unexpected environment dynamics. For robust plan execution, a great number of plan execution monitoring works has been proposed to estimate plan execution effects and make recovery plans for any detected plan failures. However, most works have assumed the full observability of environment states and accessibility of complete information about environment dynamics, which shows limitations when executing plans under environment dynamics and partial observability. To efficiently and effectively monitor robot plans in dynamic and partially observable environments, this paper first proposes an accompanying action policy that specifies an interaction pattern between information-gathering plan and the task plan to estimate and monitor task plan execution. To provide a concrete implementation of the above pattern, we first identify the task achievement and execution monitoring as two separated goals in a robot task, and then propose a hybrid planning approach that integrates two planners to solve the goals. For a task-achievement goal, we utilize a classical planning framework ROSPlan to efficiently compute the global task plan. While executing each action of the plan, we cast the execution monitoring problem as a Partially Observable Markov Decision Process (POMDP), which plans the information-gathering plans for monitors the action execution effects and recover failures when necessary. We further implement a typical robotic service task to verify the efficiency and effectiveness of our approach. By comparing with both the baseline plan-invariant execution monitoring approach and a full POMDP planning approach, the hybrid planning approach is efficient in task planning and execution monitoring and effectively recovering plan failures in unknown environments. © 2021, The Author(s), under exclusive licence to Springer Nature B.V.",
10.1007/s12369-024-01192-4,"A Hybrid Cognitive Architecture to Generate, Control, Plan, and Monitor Behaviors for Interactive Autonomous Robots","Interactive robots not only need to react in predefined or deterministic scenarios but also learn and adapt in real-time, mirroring cognitive flexibility akin to human intelligence. Achieving this autonomy entails developing cognitive architectures that integrate reactive, deliberative and emergent capabilities. Thus, this paper presents MERLIN2, a hybrid cognitive architecture to generate, control, plan, and monitor behaviors in autonomous robots. This architecture combines reactive, deliberative, and emergent components, aiming to enhance adaptability in dynamic environments and make intelligent real-time decisions, thereby improving autonomy and performance. MERLIN2 comprises a deliberative system, based on a knowledge base and a symbolic planner; and a behavioral system composed of reactive components and several emergent components. It addresses core cognitive aspects like action selection, perception, memory, learning, reasoning, and explainability. MERLIN2 is evaluated in a simulated world and in the real world Carry My Luggage task from the RoboCup@Home. Therefore, the experimentation presented in this article showcases the architecture as a valid solution for autonomous robots. © The Author(s) 2024.",
10.1007/s13748-025-00394-9,Synthesizing Evolving Symbolic Representations for Autonomous Systems,"This work presents a novel architecture for an open-ended learning system that integrates intrinsic motivation (IM) and classical planning to enable agents continuously learn and improve their knowledge over time in an unsupervised fashion. The main goal is to allow the agent to autonomously distill its experience into Probabilistic Planning Domain Definition Language (PPDDL) terms, thereby making causal relationships explicit and supporting automated planning. Starting with a virtually empty set of predefined tasks or goals, the agent harnesses intrinsic motivation to explore the environment autonomously, continuously using and enriching the high-level knowledge acquired through its experience in a virtuous cycle. Experimental evaluation in the Treasure Game domain demonstrates the effectiveness of the proposed approach: starting with only a small set of primitive actions, we show how an agent can autonomously build and refine a high-level representation of the environment. Planning-based strategies grounded in this representation significantly outperform uninformed exploration by reaching intermediate sub-goals more efficiently and substantially reducing the time required to achieve the final objective. © The Author(s) 2025.",
10.1016/j.artint.2024.104181,Planning with mental models – Balancing explanations and explicability,"Human-aware planning involves generating plans that are explicable, i.e. conform to user expectations, as well as providing explanations when such plans cannot be found. In this paper, we bring these two concepts together and show how an agent can achieve a trade-off between these two competing characteristics of a plan. To achieve this, we conceive a first-of-its-kind planner MEGA that can reason about the possibility of explaining a plan in the plan generation process itself. We will also explore how solutions to such problems can be expressed as “self-explaining plans” – and show how this representation allows us to leverage classical planning compilations of epistemic planning to reason about this trade-off at plan generation time without having to incur the computational burden of having to search in the space of differences between the agent model and the mental model of the human in the loop in order to come up with the optimal trade-off. We will illustrate these concepts in two well-known planning domains, as well as with a robot in a typical search and reconnaissance task. Human factor studies in the latter highlight the usefulness of the proposed approach. © 2024",
10.1016/j.is.2020.101639,A knowledge-intensive adaptive business process management framework,"Business process management has been the driving force of optimization and operational efficiency for companies until now, but the digitalization era we have been experiencing requires businesses to be agile and responsive as well. In order to be a part of this digital transformation, delivering new levels of automation-fueled agility through digitalization of BPM itself is required. However, the automation of BPM cannot be achieved by solely focusing on process space and classical planning techniques. It requires a holistic approach that also captures the social aspects of the business environment, such as corporate strategies, organization policies, negotiations, and cooperation. For this purpose, we combine BPM, knowledge-intensive systems and intelligent agent technologies, and yield one consolidated intelligent business process management framework, namely agileBPM, that governs the entire BPM life-cycle. Accordingly, agileBPM proposes a modeling methodology to semantically capture the business interests, enterprise environment and process space in accordance with the agent-oriented software engineering paradigm. The proposed agent-based process execution environment provides cognitive capabilities (such as goal-driven planning, norm compliance, knowledge-driven actions, and dynamic cooperation) on top of the developed business models to support knowledge workers’ multi-criteria decision making tasks. The context awareness and exception handling capabilities of the proposed approach have been presented with experimental studies. Through comparative evaluations, it is shown that agileBPM is the most comprehensive knowledge-intensive process management solution. © 2020",
10.1016/j.robot.2023.104415,A memory system of a robot cognitive architecture and its implementation in ArmarX,"Cognitive agents such as humans and robots perceive their environment through an abundance of sensors producing streams of data that need to be processed to generate intelligent behavior. A key question of cognition-enabled and AI-driven robotics is how to organize and manage such data and knowledge efficiently in a cognitive robot control architecture. We argue, that memory is a central active component of such architectures that mediates between semantic and sensorimotor representations, orchestrates the flow of data streams and events between different processes and provides the components of a cognitive architecture with data-driven services for learning semantics from sensorimotor data, the parametrization of symbolic plans for execution and prediction of action effects. Based on related work, and the experience gained in developing our ARMAR humanoid robot systems, we identified conceptual and technical requirements of a memory system as central component of cognitive robot control architecture that facilitate the realization of high-level cognitive abilities such as explaining, reasoning, prospection, simulation and augmentation. Conceptually, a memory should be active, support multi-modal data representations, associate knowledge, be introspective, and have an inherently episodic structure. Technically, the memory should support a distributed design, be access-efficient and capable of long-term data storage. We introduce the memory system for our cognitive robot control architecture and its implementation in the robot software framework ArmarX. We evaluate the efficiency of the memory system with respect to transfer speeds, compression, reproduction and prediction capabilities. © 2023",
10.1016/j.simpa.2023.100477,MERLIN2: MachinEd Ros 2 pLanINg[Formula presented],"Any service robot should be able to make decisions and schedule tasks to reach predefined goals such as opening a door or assisting users at home. However, these processes are not single short-term tasks anymore and it is required to set long-term skills for establishing a control architecture that allows robots to perform daily tasks. This paper presents MERLIN2, a hybrid cognitive architecture based on symbolic planning and state machine decision-making systems that allows performing robot behaviors. The architecture can run in any robot running ROS 2, the latest version of the Robot Operative System. MERLIN2 is available at https://github.com/MERLIN2-ARCH/merlin2. © 2023 The Author(s)",
10.1093/logcom/exad036,ECHO: A hierarchical combination of classical and multi-agent epistemic planning problems,"The continuous interest in Artificial Intelligence (AI) has brought, among other things, the development of several scenarios where multiple artificial entities interact with each other. As for all the other autonomous settings, these multi-agent systems require orchestration. This is, generally, achieved through techniques derived from the vast field of Automated Planning. Notably, arbitration in multi-agent domains is not only tasked with regulating how the agents act, but must also consider the interactions between the agents' information flows and must, therefore, reason on an epistemic level. This brings a substantial overhead that often diminishes the reasoning process's usability in real-world situations. To address this problem, we present ECHO, a hierarchical framework that embeds classical and multi-agent epistemic (epistemic, for brevity) planners in a single architecture. The idea is to combine (i) classical; and(ii) epistemic solvers to model efficiently the agents' interactions with the (i) 'physical world'; and(ii) information flows, respectively. In particular, the presented architecture starts by planning on the 'epistemic level', with a high level of abstraction, focusing only on the information flows. Then it refines the planning process, due to the classical planner, to fully characterize the interactions with the 'physical' world. To further optimize the solving process, we introduced the concept of macros in epistemic planning and enriched the 'classical' part of the domain with goal-networks. Finally, we evaluated our approach in an actual robotic environment showing that our architecture indeed reduces the overall computational time. © 2023 The Author(s). Published by Oxford University Press. All rights reserved.",
10.1109/ACCESS.2020.3003991,A Software Architecture for Service Robots Manipulating Objects in Human Environments,"This paper presents a software architecture for robots providing manipulation services autonomously in human environments. In an unstructured human environment, a service robot often needs to perform tasks even without human intervention and prior knowledge about tasks and environments. For autonomous execution of tasks, varied processes are necessary such as perceiving environments, representing knowledge, reasoning with the knowledge, and planning for task and motion. While developing each of the processes is important, integrating them into a working system for deployment is also important as a robotic system can bring tangible outcomes when it works in real world. However, such an architecture has been rarely realized in the literature owing to the difficulties of a full integration, deployment, understanding high-level goals without human interventions. In this work, we suggest a software architecture that integrates the components necessary to perform tasks by a real robot without human intervention. We show our architecture composed of deep learning based perception, symbolic reasoning, AI task planning, and geometric motion planning. We implement a deep neural network that produces information about the environment, which are then stored in a knowledge base. We implement a reasoner that processes the knowledge to use the result for task planning. We show our implementation of the symbolic task planner that generates a sequence of motion predicates. We implement an interface that computes geometric information necessary for motion planning to execute the symbolic task plans. We describe the deployment of the architecture through the result of lab tests and a public demonstration. The architecture is developed based on Robot Operating System (ROS) so compatible with any robot that is capable of object manipulation and mobile navigation running in ROS. We deploy the architecture to two different robot platforms to show the compatibility.",
10.1109/ACCESS.2020.3034524,Real-Time Object Navigation With Deep Neural Networks and Hierarchical Reinforcement Learning,"In the last years, deep learning and reinforcement learning methods have significantly improved mobile robots in such fields as perception, navigation, and planning. But there are still gaps in applying these methods to real robots due to the low computational efficiency of recent neural network architectures and their poor adaptability to robotic experiments' realities. In this article, we consider an important task in mobile robotics - navigation to an object using an RGB-D camera. We develop a new neural network framework for robot control that is fast and resistant to possible noise in sensors and actuators. We propose an original integration of semantic segmentation, mapping, localization, and reinforcement learning methods to improve the effectiveness of exploring the environment, finding the desired object, and quickly navigating to it. We created a new HISNav dataset based on the Habitat virtual environment, which allowed us to use simulation experiments to pre-train the model and then upload it to a real robot. Our architecture is adapted to work in a real-time environment and fully implements modern trends in this area.",
